6,SI,VIGENTE,BLOQUEO PARCIAL,12/03/2023,16/03/2023 08:30 HORAS,AMAZONAS/CHACHAPOYAS/BALSAS,KM 170,"SECTOR CERRO VIEJO  VIA AFECTADA POR DERRUMBE, SE VIENEN REALIZANDO LOS TRABAJOS DE LIMPIEZA DE LA VIA",-6.847398157,-77.98440846,-6.847398157+-77.98440846,2023 08:30 HORAS+03+16+08:30,0,0,COE-MTC,CLIMATOLOGICO,PE-08B,CARRETERA CAJAMARCA - CHACHAPOYAS - MOYOBAMBA,SI,restringido
327,SI,VIGENTE,BLOQUEO PARCIAL,15/03/2023,16/03/2023 08:30 HORAS,LA LIBERTAD/CHUCLAYO/OYOTUN,KM 45+455,VIA AFECTADA POR LA ACTIVACION DE QUEBRADA,-6.874516324,-79.31385663,-6.874516324+-79.31385663,2023 08:30 HORAS+03+16+08:30,0,0,CONCESIONARIA CONVIAL SIERRA NORTE,CLIMATOLOGICO,PE-1NI,CARRETERA ZAÑA - CAYALTI - BOLIVAR,SI,restringido
328,SI,VIGENTE,BLOQUEO PARCIAL,10/03/2023,16/03/2023 08:30 HORAS,LAMBAYEQUE/CHICLAYO/CAYALTI,KM 19+870,"DEBIDO A LAS FUERTES LLUVIAS, EL RIO ZAÑA AUMENTO SU CAUDAL AFECTANDO LA VIA.",-6.909280108,-79.52839029,-6.909280108+-79.52839029,2023 08:30 HORAS+03+16+08:30,0,0,CONCESION VALLE DEL ZAÑA,CLIMATOLOGICO,PE-1NI,CARRETERA ZAÑA - CAYALTI - BOLIVAR,SI,restringido
167,SI,VIGENTE,BLOQUEO PARCIAL,12/03/2023,16/03/2023 08:30 HORAS,CAJAMARCA/SAN PABLO/SAN BERNARDINO,KM 16+320- KM 20+100,SECTOR SANGAL  VIA AFECTADA POR DERRUMBES. VIA ALTERNA DV. CHILETE – CAJAMARCA,-7.154697,-78.8392236,-7.154697+-78.8392236,2023 08:30 HORAS+03+16+08:30,0,0,CONCESIONARIA CONVIAL SIERRA NORTE,CLIMATOLOGICO,PE-08A,CARRETERA CHILETE - SAN PABLO - CAJAMARCA,SI,restringido
158,SI,VIGENTE,BLOQUEO PARCIAL,14/03/2023,16/03/2023 08:30 HORAS,CAJAMARCA/CAJAMARCA/LOS BAÑOS DEL INCA,KM 13,VIA AFECTADA POR DESLIZAMIENTO DE LODO Y PIEDRAS,-7.1573044,-78.42420116,-7.1573044+-78.42420116,2023 08:30 HORAS+03+16+08:30,0,0,CEOPOL,CLIMATOLOGICO,PE-08B,CARRETERA CAJAMARCA - CHACHAPOYAS - MOYOBAMBA,SI,restringido
170,SI,VIGENTE,BLOQUEO PARCIAL,15/03/2023,16/03/2023 08:30 HORAS,CAJAMARCA/SAN PABLO/SAN BERNARDINO,KM 07+590- 07+620,SECTOR MAICHIL VIA AFECTADA POR DERRUMBES,-7.1763028,-78.8271579,-7.1763028+-78.8271579,2023 08:30 HORAS+03+16+08:30,0,0,CONCESIONARIA CONVIAL SIERRA NORTE,CLIMATOLOGICO,PE-08A,CARRETERA CHILETE - SAN PABLO - CAJAMARCA,SI,restringido
153,SI,VIGENTE,BLOQUEO PARCIAL,12/03/2023,16/03/2023 08:30 HORAS,CAJAMARCA/CONTUMAZA/YONAN,KM 71+450,SECTOR QUINDEN VIA AFECTADA POR DERRUMBES,-7.18900543,-78.99277797,-7.18900543+-78.99277797,2023 08:30 HORAS+03+16+08:30,0,0,CONCESIONARIA CONVIAL SIERRA NORTE,CLIMATOLOGICO,PE-08,CARRETERA PACASMAYO - CHILETE - CAJAMARCA,SI,restringido
149,SI,VIGENTE,BLOQUEO PARCIAL,13/03/2023,16/03/2023 08:30 HORAS,CAJAMARCA/CONTUMAZA/TANTARICA,KM 77+200,VIA AFECTADA POR DESLIZAMIENTO DE PIEDRAS Y LODO PRODUCTO DE LAS LLUVIAS,-7.205431596,-78.93932257,-7.205431596+-78.93932257,2023 08:30 HORAS+03+16+08:30,0,0,CONCESIONARIA CONVIAL SIERRA NORTE,CLIMATOLOGICO,PE-08,CARRETERA PACASMAYO - CHILETE - CAJAMARCA,SI,restringido
135,SI,VIGENTE,BLOQUEO PARCIAL,24/02/2023,16/03/2023 08:30 HORAS,CAJAMARCA/CAJAMARCA/MAGDALENA,KM 103+680- KM 104+180,(SECTOR HUAQUILLAS) DEBIDO A LAS CONSTANTES LLUVIAS QUE INCREMENTO EL CAUDAL DEL RIO SE PRODUJO LA SOCAVACION DE PLATAFORMA,-7.220392127,-78.73954091,-7.220392127+-78.73954091,2023 08:30 HORAS+03+16+08:30,0,0,CONCESIONARIA CONVIAL SIERRA NORTE,CLIMATOLOGICO,PE-08,CARRETERA PACASMAYO - CHILETE - CAJAMARCA,SI,restringido
169,SI,VIGENTE,BLOQUEO PARCIAL,15/03/2023,16/03/2023 08:30 HORAS,CAJAMARCA/CONTUMAZA/CHILETE,KM 0 AL KM 24,VIA AFECTADA POR DERRUMBES,-7.2236751,-78.8476218,-7.2236751+-78.8476218,2023 08:30 HORAS+03+16+08:30,0,0,CONCESIONARIA CONVIAL SIERRA NORTE,CLIMATOLOGICO,PE-08A,CARRETERA CHILETE - SAN PABLO - CAJAMARCA,SI,restringido
152,SI,VIGENTE,BLOQUEO PARCIAL,15/03/2023,16/03/2023 08:30 HORAS,CAJAMARCA/CAJAMARCA/CAJAMARCA,KM 165,SECTOR GAVILAN  VIA AFECTADA POR DERRUMBES,-7.23642833,-78.47979833,-7.23642833+-78.47979833,2023 08:30 HORAS+03+16+08:30,0,0,CONCESIONARIA CONVIAL SIERRA NORTE,CLIMATOLOGICO,PE-08,CARRETERA PACASMAYO - CHILETE - CAJAMARCA,SI,restringido
151,SI,VIGENTE,BLOQUEO PARCIAL,15/03/2023,16/03/2023 08:30 HORAS,CAJAMARCA/CONTUMAZA/YONAN,KM 52 AL KM 90,"(SECTOR TEMBLADERA HASTA SECTOR CHILETE) VIA AFECTADA POR DERRUMBES, LA CONCESIONARIA INFORMA QUE ESTAN REALIZANDOLOS TRABAJOS DE LIMPIEZA",-7.252615009,-79.12561938,-7.252615009+-79.12561938,2023 08:30 HORAS+03+16+08:30,0,0,COE-MTC,CLIMATOLOGICO,PE-08,CARRETERA PACASMAYO - CHILETE - CAJAMARCA,SI,restringido
312,SI,VIGENTE,BLOQUEO PARCIAL,08/03/2023,16/03/2023 08:30 HORAS,LA LIBERTAD/SANCHEZ CARRION/COCHORCO,KM 51 - KM 52+800,VIA AFECTADA POR DERRUMBE,-7.76698179,-77.77481868,-7.76698179+-77.77481868,2023 08:30 HORAS+03+16+08:30,0,0,COE-MTC,CLIMATOLOGICO,PE-10C,CARRETERA EL PALLAR - TAYABAMBA - HUANCASPATA,SI,restringido
526,SI,VIGENTE,BLOQUEO PARCIAL,07/03/2023,16/03/2023 08:30 HORAS,SAN MARTIN/TOCACHE/POLVORA,KM 695,SECTOR VIEJO SAN MARTIN - KM 710+800 SIGEO-MTC VIA AFECTADA POR LA EROSION / SOCAVACION DE PLATAFORMA,-7.79489253,-76.67277516,-7.79489253+-76.67277516,2023 08:30 HORAS+03+16+08:30,0,0,COE-MTC,CLIMATOLOGICO,PE-5N,CARRETERA LONGITUDINAL DE LA SELVA NORTE,SI,restringido
313,SI,VIGENTE,BLOQUEO PARCIAL,10/03/2023,16/03/2023 08:30 HORAS,LA LIBERTAD/SANCHEZ CARRION/CURGOS,KM 9+600 - KM 17,VIA AFECTADA POR DERRUMBE,-7.803113505,-77.92979311,-7.803113505+-77.92979311,2023 08:30 HORAS+03+16+08:30,0,0,COE-MTC,CLIMATOLOGICO,PE-10B,CARRETERA HUAMACHUCO - BAMBAMARCA - JUANJUI,SI,restringido
325,SI,VIGENTE,BLOQUEO PARCIAL,13/03/2023,16/03/2023 08:30 HORAS,LA LIBERTAD/ASCOPE/CHICAMA,KM 602+200,VIA AFECTADA POR ACTIVACION DE QUEBRADA,-7.878988691,-79.13049614,-7.878988691+-79.13049614,2023 08:30 HORAS+03+16+08:30,0,0,CEOPOL,CLIMATOLOGICO,PE-1N,CARRETERA LONGITUDINAL DE LA COSTA NORTE,SI,restringido
310,SI,VIGENTE,BLOQUEO PARCIAL,15/03/2023,16/03/2023 08:30 HORAS,LA LIBERTAD/OTUZCO/OTUZCO,"KM 62, KM 67 Y KM 69","SECTOR CASMICHE, CATARATA Y TAYAHUAL  SE CULMINO CON LA LIMPIEZA DE LA VIA AFECTADA POR DERRUMBE",-7.96021166,-78.63191333,-7.96021166+-78.63191333,2023 08:30 HORAS+03+16+08:30,0,0,CONCESIONARIA CONVIAL SIERRA NORTE,CLIMATOLOGICO,PE-10A,CARRETERA TRUJILLO - AGALLPAMPA - QUIRUVILCA,SI,restringido
308,SI,VIGENTE,BLOQUEO PARCIAL,12/03/2023,16/03/2023 08:30 HORAS,LA LIBERTAD/OTUZCO/OTUZCO,KM 54 - KM 59+900,SECTORES PLAZAPAMPA A CASMICHE VIA AFECTADA POR DERRUMBE,-7.960211667,-78.63191333,-7.960211667+-78.63191333,2023 08:30 HORAS+03+16+08:30,0,0,CONCESIONARIA CONVIAL SIERRA NORTE,CLIMATOLOGICO,PE-10A,CARRETERA TRUJILLO - AGALLPAMPA - QUIRUVILCA,SI,restringido
320,SI,VIGENTE,BLOQUEO PARCIAL,15/03/2023,16/03/2023 08:30 HORAS,LA LIBERTAD/TRUJILLO/SIMBAL,KM 32 - KM 37,SECTORES CRUZ BLANCA - SHIRAN VIA AFECTADA POR DESLIZAMIENTO DE PIEDRAS Y LODO PRODUCTO DE LAS LLUVIAS EN LA ZONA,-8.009685,-78.79362333,-8.009685+-78.79362333,2023 08:30 HORAS+03+16+08:30,0,0,CONCESIONARIA CONVIAL SIERRA NORTE,CLIMATOLOGICO,PE-10A,CARRETERA TRUJILLO - AGALLPAMPA - QUIRUVILCA,SI,restringido
311,SI,VIGENTE,BLOQUEO PARCIAL,21/02/2023,16/03/2023 08:30 HORAS,LA LIBERTAD/PATAZ/HUANCASPATA,KM 320 - KM 330,"PERDIDA DE PLATAFORMA, PRODUCTO DE LAS INTENSAS LLUVIAS QUE VIENEN SUCEDIENDO, SE MANTIENE EL TRÁNSITO VEHICULAR RESTRINGIDO",-8.48117107,-77.30045333,-8.48117107+-77.30045333,2023 08:30 HORAS+03+16+08:30,0,0,COE-MTC,CLIMATOLOGICO,PE-10C,CARRETERA EL PALLAR - TAYABAMBA - HUANCASPATA,SI,restringido
27,SI,VIGENTE,BLOQUEO PARCIAL,07/03/2023,16/03/2023 08:30 HORAS,ANCASH/POMABAMBA/PAROBAMBA,KM  129-130,(SECTOR SUCHIMAN) VIA AFECTADA POR HUAICO,-8.528816509,-77.39511876,-8.528816509+-77.39511876,2023 08:30 HORAS+03+16+08:30,0,0,COE-MTC,CLIMATOLOGICO,PE-12A,CARRETERA LA PAMPA - CUSCA - SIHUAS - HUACRACHUCO - UCHIZA,SI,restringido
273,SI,VIGENTE,BLOQUEO PARCIAL,01/03/2023,16/03/2023 08:30 HORAS,HUANUCO/MARAÑON/CHOLON,KM 270+200,"(SECTOR AUQUISH)  SE VIENE REALIZANDO LOS TRABAJOS DE ELIMINACION DE MATERIAL SUELTO, SE CUENTA CON 01 CARGADOR FRONTAL Y PERSONAL, ESTE PROVENIENTE DEL DESLIZAMIENTO DE TALUD SUPERIOR",-8.622538,-76.733355,-8.622538+-76.733355,2023 08:30 HORAS+03+16+08:30,0,0,COE-MTC,CLIMATOLOGICO,PE-12A,CARRETERA LA PAMPA - CUSCA - SIHUAS - HUACRACHUCO - UCHIZA,SI,restringido
25,SI,VIGENTE,BLOQUEO PARCIAL,13/03/2023,16/03/2023 08:30 HORAS,ANCASH/HUAYLAS/HUALLANCA,KM 675,INGRESO A LOS TUNELES - CAÑON DEL PATO VIA AFECTADA POR DERRUMBE,-8.828765411,-77.83058248,-8.828765411+-77.83058248,2023 08:30 HORAS+03+16+08:30,0,0,CEOPOL,CLIMATOLOGICO,PE-3N,CARRETERA LONGITUDINAL DE LA SIERRA NORTE,SI,restringido
34,SI,VIGENTE,BLOQUEO PARCIAL,14/03/2023,16/03/2023 08:30 HORAS,ANCASH/SANTA/SANTA,KM 3 AL 25,VIA AFECTADA POR DESLIZAMIENTO,-8.97532755,-78.59722339,-8.97532755+-78.59722339,2023 08:30 HORAS+03+16+08:30,0,0,CEOPOL,CLIMATOLOGICO,PE-12,CARRETERA SANTA - CHUQUICARA,SI,restringido
31,SI,VIGENTE,BLOQUEO PARCIAL,15/03/2023,16/03/2023 08:30 HORAS,ANCASH/HUAYLAS/HUATA,KM 656-880,DESPRENDIMIENTO A CONSECUENCIA DE LA EROSION DEL RIO SANTA,-8.991305344,-77.321173012622,-8.991305344+-77.321173012622,2023 08:30 HORAS+03+16+08:30,0,0,CEOPOL,CLIMATOLOGICO,PE-3N,CARRETERA LONGITUDINAL DE LA SIERRA NORTE,SI,restringido
24,SI,VIGENTE,BLOQUEO PARCIAL,24/02/2023,16/03/2023 08:30 HORAS,ANCASH/HUAYLAS/CARAZ,KM 654+900 - KM 673+250,VIA AFECTADA POR DERRUMBE DEBIDO A LAS CONSTANTES LLUVIAS EN LA ZONA,-8.998836959,-77.81852789,-8.998836959+-77.81852789,2023 08:30 HORAS+03+16+08:30,0,0,COE-MTC,CLIMATOLOGICO,PE-3N,CARRETERA LONGITUDINAL DE LA SIERRA NORTE,SI,restringido
553,SI,VIGENTE,BLOQUEO PARCIAL,06/02/2023,16/03/2023 08:30 HORAS,UCAYALI/PADRE ABAD/PADRE ABAD,KM 423+100 - KM 423+400,(SECTOR BOQUERON) VIA AFECTADA POR DERRUMBE DEL TALUD SUPERIOR Y PERDIDA DE PLATAFORMA POR LAS CONSTANTES LLUVIAS,-9.060062,-75.668282,-9.060062+-75.668282,2023 08:30 HORAS+03+16+08:30,0,0,COE-MTC,CLIMATOLOGICO,PE-5N,CARRETERA LONGITUDINAL DE LA SELVA NORTE,SI,restringido
554,SI,VIGENTE,BLOQUEO PARCIAL,08/03/2023,16/03/2023 08:30 HORAS,UCAYALI/PADRE ABAD/PADRE ABAD,KM 430+300 - KM 430+800,"SECTOR PUENTE COCO VIA AFECTADA POR DERRUMBE, SE CONTINUAN REALIZANDO LOS TRABAJOS DE LIMPIEZA EN LA ZONA",-9.088864017,-75.72683617,-9.088864017+-75.72683617,2023 08:30 HORAS+03+16+08:30,0,0,COE-MTC,CLIMATOLOGICO,PE-5N,CARRETERA LONGITUDINAL DE LA SELVA NORTE,SI,restringido
557,SI,VIGENTE,BLOQUEO PARCIAL,09/03/2023,16/03/2023 08:30 HORAS,UCAYALI/PADRE ABAD/PADRE ABAD,KM 434+900 - KM 434+990,"SECTOR CHANCADORA  SE CONTINUAN CON LOS TRABAJOS DE ELIMINACION DE MATERIAL EXCEDENTE DE DERRUMBE, AMPLIACION DE VIA PARA DESVIO DE VEHICULOS, Y CORTE DE PLATAFORMA. ESTO DEBIDO A LA EROSION DE PLATAFORMA Y AL DERRUMBE DEL TALUD SUPERIOR. SE TIENE TRÁNSITO VEHICULAR RESTRINGIDO.",-9.115125594,-75.74732922,-9.115125594+-75.74732922,2023 08:30 HORAS+03+16+08:30,0,0,COE-MTC,CLIMATOLOGICO,PE-5N,CARRETERA LONGITUDINAL DE LA SELVA NORTE,SI,restringido
558,SI,VIGENTE,BLOQUEO PARCIAL,10/03/2023,16/03/2023 08:30 HORAS,UCAYALI/PADRE ABAD/PADRE ABAD,KM 437+150 - KM 437+180,"SECTOR NUEVO MUNDO  CONTINUAN LOS TRABAJOS DE ELIMINACION DE MATERIAL EXCEDENTE DE DERRUMBE SOBRE LA PLATAFORMA, ESTO DEBIDO POR LAS LLUVIAS CONSTANTES EN LA ZONA. SE TIENE TRÁNSITO VEHICULAR RESTRINGIDO.",-9.133946352,-75.75145003,-9.133946352+-75.75145003,2023 08:30 HORAS+03+16+08:30,0,0,COE-MTC,CLIMATOLOGICO,PE-5N,CARRETERA LONGITUDINAL DE LA SELVA NORTE,SI,restringido
37,SI,VIGENTE,BLOQUEO PARCIAL,14/03/2023,16/03/2023 08:30 HORAS,ANCASH/SANTA/SAMANCO,KM 406,VIA AFECTADA POR EL AUMENTO DEL CAUDAL  DEL RIO,-9.269549595,-78.42203545,-9.269549595+-78.42203545,2023 08:30 HORAS+03+16+08:30,0,0,CEOPOL,CLIMATOLOGICO,PE-1N,CARRETERA LONGITUDINAL DE LA COSTA NORTE,SI,restringido
40,SI,VIGENTE,BLOQUEO PARCIAL,10/03/2023,16/03/2023 08:30 HORAS,ANCASH/CASMA/CASMA,KM 376,VIA AFECTADA POR HUAICO,-9.481614802,-78.29024738,-9.481614802+-78.29024738,2023 08:30 HORAS+03+16+08:30,0,0,CEOPOL,CLIMATOLOGICO,PE-1N,CARRETERA LONGITUDINAL DE LA COSTA NORTE,SI,restringido
16,SI,VIGENTE,BLOQUEO PARCIAL,10/03/2023,16/03/2023 08:30 HORAS,ANCASH/CASMA/YAUTAN,KM 30 AL KM 34,VIA AFECTADA POR DESLIZAMIENTO DE LODO Y PIEDRAS PRODUCTO DE LAS LLUVIAS EN LA ZONA.,-9.510337,-78.0590792,-9.510337+-78.0590792,2023 08:30 HORAS+03+16+08:30,0,0,COE-MTC,CLIMATOLOGICO,PE-14,CARRETERA CASMA - HUARAZ,SI,restringido
32,SI,VIGENTE,BLOQUEO PARCIAL,14/02/2023,16/03/2023 08:30 HORAS,ANCASH/RECUAY/CATAC,KM 23,LAGUNA QUEROCOCHA VIA AFECTADA POR DESPRENDIMIENTO DE PIEDRA Y LODO,-9.720769326,-77.32117301,-9.720769326+-77.32117301,2023 08:30 HORAS+03+16+08:30,0,0,COE-MTC,CLIMATOLOGICO,AN-110,VIA CATAC- HUARI,SI,restringido
30,SI,VIGENTE,BLOQUEO PARCIAL,14/02/2023,16/03/2023 08:30 HORAS,ANCASH/RECUAY/CATAC,KM 543-KM 560,"(SECTOR : CATAC - BEDOYA)  EROSION DE PLATAFORMA, PRODUCTO DE LAS LLUVIAS INTENSAS  EN LA ZONA",-9.806532604,-77.43076157,-9.806532604+-77.43076157,2023 08:30 HORAS+03+16+08:30,0,0,COE-MTC,CLIMATOLOGICO,PE-3N,CARRETERA LONGITUDINAL DE LA SIERRA NORTE,SI,restringido
23,SI,VIGENTE,BLOQUEO PARCIAL,10/03/2023,16/03/2023 08:30 HORAS,ANCASH/HUARMEY/CULEBRAS,KM 316 AL KM 334,VIA AFECTADA POR HUAICO,-9.907529818,-78.21443708,-9.907529818+-78.21443708,2023 08:30 HORAS+03+16+08:30,0,1,CEOPOL / UD ANCASH,CLIMATOLOGICO,PE-1N,CARRETERA LONGITUDINAL DE LA COSTA NORTE,SI,restringido
358,SI,VIGENTE,BLOQUEO TOTAL,14/03/2023,16/03/2023 08:30 HORAS,LIMA/HUAURA/SAYAN,KM 65,VIA AFECTADA POR LA ACTIVACION DE QUEBRADAS Y DESBORDE DE ASEQUIAS,-11.043217,-77.09888,-11.043217+-77.09888,2023 08:30 HORAS+03+16+08:30,0,0,CEOPOL / DIVPRCAR LIMA NORTE,CLIMATOLOGICO,PE-18,CARRETERA CHANCAY - OYON - AMBO,SI,interrumpido
345,SI,VIGENTE,BLOQUEO TOTAL,15/03/2023,16/03/2023 08:30 HORAS,LIMA/CANTA/SANTA ROSA DE QUIVES,KM 52,VIA AFECTADA POR HUAICO,-11.69730729,-76.82767064,-11.69730729+-76.82767064,2023 08:30 HORAS+03+16+08:30,0,0,VOLCAN CCMS,CLIMATOLOGICO,PE-20A,CARRTERA TRAPICHE - CANTA - HUAYLLAY - VICCO,SI,interrumpido
375,SI,VIGENTE,BLOQUEO TOTAL,15/03/2023,16/03/2023 08:30 HORAS,LIMA/LIMA/CARABAYLLO,KM 31,VIA AFECTADA POR LLUVIAS,-11.74961627,-76.97359582,-11.74961627+-76.97359582,2023 08:30 HORAS+03+16+08:30,0,0,CEOPOL,CLIMATOLOGICO,PE-20A,CARRTERA TRAPICHE - CANTA - HUAYLLAY - VICCO,SI,interrumpido
351,SI,VIGENTE,BLOQUEO TOTAL,3/15/2023,16/03/2023 08:30 HORAS,LIMA/HUAROCHIRI/SAN ANTONIO,KM 0,ANEXO 22 JICAMARCA VIA AFECTADA POR HUAICO,-11.911436,-76.94804,-11.911436+-76.94804,2023 08:30 HORAS+03+16+08:30,0,0,COMISARIA PNP JICAMARCA,CLIMATOLOGICO,LI-714,VIA SAN JUAN DE LURIGANCHO - JICAMARCA,SI,interrumpido
364,SI,VIGENTE,BLOQUEO TOTAL,14/03/2023,16/03/2023 08:30 HORAS,LIMA/LIMA/CIENEGUILLA,KM 29,HUAICO OBSTRUYE LA VIA EN AMBOS SENTIDOS,-12.078799,-76.765905,-12.078799+-76.765905,2023 08:30 HORAS+03+16+08:30,0,0,CEOPOL,CLIMATOLOGICO,LM-117,VIA DEPARTAMENTAL LIMA - CIENEGUILLA,SI,interrumpido
363,SI,VIGENTE,BLOQUEO TOTAL,14/03/2023,16/03/2023 08:30 HORAS,LIMA/LIMA/CIENEGUILLA,KM 12,HUAICO OBSTRUYE LA VIA EN AMBOS SENTIDOS,-12.084756,-76.876441,-12.084756+-76.876441,2023 08:30 HORAS+03+16+08:30,0,0,CEOPOL,CLIMATOLOGICO,LM-119,VIA DEPARTAMENTAL LIMA - CIENEGUILLA,SI,interrumpido
378,SI,VIGENTE,BLOQUEO TOTAL,14/03/2023,16/03/2023 08:30 HORAS,LIMA/LIMA/PUNTA HERMOSA,KM 40,ACTIVACION DE HUAICO,-12.33187555,-76.82101265,-12.33187555+-76.82101265,2023 08:30 HORAS+03+16+08:30,0,0,RUTAS DE LIMA,CLIMATOLOGICO,PE-1S,CARRETERA LONGITUDINAL DE LA COSTA SUR,SI,interrumpido
362,SI,VIGENTE,BLOQUEO TOTAL,15/03/2023,16/03/2023 08:30 HORAS,LIMA/CAÑETE/CHILCA,KM 62,VIA AFECTADA POR DESBORDE DE RIO.,-12.52080097,-76.72761938,-12.52080097+-76.72761938,2023 08:30 HORAS+03+16+08:30,0,0,COMISARIA PNP CHILCA,CLIMATOLOGICO,PE-1S,CARRETERA LONGITUDINAL DE LA COSTA SUR,SI,interrumpido
361,SI,VIGENTE,BLOQUEO TOTAL,14/03/2023,16/03/2023 08:30 HORAS,LIMA/CAÑETE/CALANGO,KM 26+900 - KM 36+900,VIA AFECTADA POR HUAICO,-12.52329763,-76.49530278,-12.52329763+-76.49530278,2023 08:30 HORAS+03+16+08:30,0,0,COE-MTC,CLIMATOLOGICO,PE-22A,CARRETERA MALA - YURACMAYO,SI,interrumpido
376,SI,VIGENTE,BLOQUEO TOTAL,15/03/2023,16/03/2023 08:30 HORAS,LIMA/YAUYOS/AYAUCA,KM 109+900,VIA AFECTADA POR HUAICO,-12.7796517,-75.92081301,-12.7796517+-75.92081301,2023 08:30 HORAS+03+16+08:30,0,0,COE-MTC,CLIMATOLOGICO,PE-24,CARRETERA CAÑETE - HUANCAYO,SI,interrumpido
365,SI,VIGENTE,BLOQUEO TOTAL,15/03/2023,16/03/2023 08:30 HORAS,LIMA/CAÑETE/NUEVO IMPERIAL,KM 24,SECTOR LUNAHUANA VIA AFECTADA POR HUAICO,-13.04737791,-76.22191655,-13.04737791+-76.22191655,2023 08:30 HORAS+03+16+08:30,0,0,COMISARIA PNP LUNAHUANA,CLIMATOLOGICO,PE-24,CARRETERA CAÑETE - HUANCAYO,SI,interrumpido
255,SI,VIGENTE,BLOQUEO TOTAL,16/02/2023,16/03/2023 08:30 HORAS,HUANCAVELICA/CASTROVIRREYNA/HUACHOS,KM 11+160 KM 11+260,(SECTOR HUANCHOS) VIA AFECTADA POR DERRUMBE PRODUCIDO POR LAS CONSTANTES LLUVIAS EN EL SECTOR,-13.216375,-75.542794,-13.216375+-75.542794,2023 08:30 HORAS+03+16+08:30,0,0,COE-MTC,CLIMATOLOGICO,PE-26A,CARRETERA HUACHOS - MOLLEPAMPA - CASTROVIRREYNA,SI,interrumpido
256,SI,VIGENTE,BLOQUEO TOTAL,10/02/2023,16/03/2023 08:30 HORAS,HUANCAVELICA/CASTROVIRREYNA/MOLLEPAMPA,KM 96,(SECTOR QUINCARA) VIA AFECTADA POR DERRUMBE PRODUCIDO POR LAS CONSTANTES LLUVIAS EN EL SECTOR. TRABAJOS SUSPENDIDOS POR INESTABILIDAD DEL TALUD SUPERIOR POR CAIDA CONSTANTE DE MATERIAL Y NEBLINA DENSA,-13.29862124,-75.40337997,-13.29862124+-75.40337997,2023 08:30 HORAS+03+16+08:30,0,0,COE-MTC,CLIMATOLOGICO,PE-26A,CARRETERA HUACHOS - MOLLEPAMPA - CASTROVIRREYNA,SI,interrumpido
280,SI,VIGENTE,BLOQUEO TOTAL,15/03/2023,16/03/2023 08:30 HORAS,ICA/ICA/OCUCAJE,KM 338,VIA AFECTADA POR HUAICO,-14.35822906,-75.63690727,-14.35822906+-75.63690727,2023 08:30 HORAS+03+16+08:30,0,0,CEOPOL,CLIMATOLOGICO,PE-1S,CARRETERA LONGITUDINAL DE LA COSTA SUR,SI,interrumpido
443,SI,VIGENTE,BLOQUEO TOTAL,07/03/2023,16/03/2023 08:30 HORAS,PIURA/PIURA/TAMBO GRANDE,KM 12+900,"SECTOR QUEBRADA SAN FRANCISCO  SE REALIZARAN TRABAJOS DE HABILITACION DE DESVIO PROVISIONAL, INSTALACION DE ALCANTARILLAS Y COLOCACION DE ENROCADO, DEBIDO A LA INUNDACION Y CONSECUENTE ASENTAMIENTO DE BADEN",-4.946,-80.258,-4.946+-80.258,2023 08:30 HORAS+03+16+08:30,0,0,COE-MTC,CLIMATOLOGICO,PE-1NR,CARRETERA CHULUCANAS - MORROPON - PACAIPAMPA,SI,interrumpido
435,SI,VIGENTE,BLOQUEO TOTAL,09/03/2023,16/03/2023 08:30 HORAS,PIURA/MORROPON/BUENOS AIRES,KM 18+800,VIA AFECTADA POR EL  DESBORDE DEL RIO MORROPON,-5.258853046,-79.96961546,-5.258853046+-79.96961546,2023 08:30 HORAS+03+16+08:30,0,0,CONCESIONARIA CANCHAQUE,CLIMATOLOGICO,PE-02A,CARRETERA LA MATANZA - HUANCABAMBA,SI,interrumpido
436,SI,VIGENTE,BLOQUEO TOTAL,08/03/2023,16/03/2023 08:30 HORAS,PIURA/MORROPON/BUENOS AIRES,KM 29+650,VIA AFECTADA POR LA  ACTIVACION DE QUEBRADA DEL BADEN DE RIO SECO,-5.328209717,-79.92517504,-5.328209717+-79.92517504,2023 08:30 HORAS+03+16+08:30,0,0,CONCESIONARIA CANCHAQUE,CLIMATOLOGICO,PE-02A,CARRETERA LA MATANZA - HUANCABAMBA,SI,interrumpido
433,SI,VIGENTE,BLOQUEO TOTAL,12/03/2023,16/03/2023 08:30 HORAS,PIURA/HUANCABAMBA/SAN MIGUEL DEL FAIQUE,"KM 71+800, KM 71+900, KM 72+100",SECTOR CANCHAQUE VIA AFECTADA POR EROSION DE LA PLATAFORMA,-5.397770232,-79.62461311,-5.397770232+-79.62461311,2023 08:30 HORAS+03+16+08:30,0,0,CONCESIONARIA CANCHAQUE,CLIMATOLOGICO,PE-02A,CARRETERA LA MATANZA - HUANCABAMBA,SI,interrumpido
441,SI,VIGENTE,BLOQUEO TOTAL,06/03/2023,16/03/2023 08:30 HORAS,PIURA/MORROPON/SALITRAL,KM 53,BADEN DEL RIO SERRAN  VIA AFECTADA POR ACTIVACION DE QUEBRADA PRODUCTO DE LAS LLUVIAS EN LA ZONA.,-5.43425963,-79.77323996,-5.43425963+-79.77323996,2023 08:30 HORAS+03+16+08:30,0,0,CONCESIONARIA CANCHAQUE,CLIMATOLOGICO,PE-02A,CARRETERA LA MATANZA - HUANCABAMBA,SI,interrumpido
425,SI,VIGENTE,BLOQUEO TOTAL,09/03/2023,16/03/2023 08:30 HORAS,PIURA/HUANCABAMBA/HUARMACA,KM 1741+900,"SECTOR SAN JOSE DE TUNAS  SE VIENE REALIZANDO TRABAJOS DE SEÑALIZACION PREVENTIVA, ESTO DEBIDO HUAICO Y PERDIDA DE LA PLATAFORMA, POR ACCION DE LA NATURALEZA, SE MANTIENE EL TRÁNSITO VEHICULAR INTERRUMPIDO.",-5.502452,-79.486101,-5.502452+-79.486101,2023 08:30 HORAS+03+16+08:30,0,0,COE MTC,CLIMATOLOGICO,PE-3N,CARRETERA LONGITUDINAL DE LA SIERRA NORTE,SI,interrumpido
338,SI,VIGENTE,BLOQUEO TOTAL,15/03/2023,16/03/2023 08:30 HORAS,LAMBAYEQUE/LAMBAYEQUE/OLMOS,KM 132,VIA AFECTADA POR DESBORDE DE QUEBRADA,-5.673818,-79.878134,-5.673818+-79.878134,2023 08:30 HORAS+03+16+08:30,0,0,CEOPOL,CLIMATOLOGICO,PE-1NJ,CARRETERA MOCCE - OLMOS - LA MATANZA - PIURA,SI,interrumpido
332,SI,VIGENTE,BLOQUEO TOTAL,11/03/2023,16/03/2023 08:30 HORAS,LAMBAYEQUE/LAMBAYEQUE/ILLIMO,KM 24+400 - KM 25+100,"DEBIDO AL DESBORDE LATERAL DEL RIO PRODUCTO DE LAS INTENSAS LLUVIAS EN LA ZONA, SE PRODUJO LA SOCAVACION DE LA PLATAFORMA",-6.472359358,-79.85580161,-6.472359358+-79.85580161,2023 08:30 HORAS+03+16+08:30,0,0,COE-MTC,CLIMATOLOGICO,PE-1NJ,CARRETERA MOCCE - OLMOS - LA MATANZA - PIURA,SI,interrumpido
175,SI,VIGENTE,BLOQUEO TOTAL,15/03/2023,16/03/2023 08:30 HORAS,CAJAMARCA/CHOTA/COCHABAMBA,KM 97+500 - KM 97+700,SECTOR MONTAN MAYO  VIA AFECTADA POR HUAICO,-6.553585359,-78.79105175,-6.553585359+-78.79105175,2023 08:30 HORAS+03+16+08:30,0,0,COE-MTC,CLIMATOLOGICO,PE-06B,CARRETERA CUMBIL - CATACHE - LAJAS,SI,interrumpido
174,SI,VIGENTE,BLOQUEO TOTAL,14/03/2023,16/03/2023 08:30 HORAS,CAJAMARCA/CHOTA/LLAMA,KM 13,SECTOR CATACHE VIA AFECTADA POR HUAICO,-6.624429537,-79.17216033,-6.624429537+-79.17216033,2023 08:30 HORAS+03+16+08:30,0,0,COE-MTC,CLIMATOLOGICO,PE-06B,CARRETERA CUMBIL - CATACHE - LAJAS,SI,interrumpido
159,SI,VIGENTE,BLOQUEO TOTAL,15/03/2023,16/03/2023 08:30 HORAS,CAJAMARCA/CELENDIN/JOSE GALVEZ,KM 85+280 - KM 85+320,VIA AFECTADA POR DERRUMBE,-6.929501353,-78.18949646,-6.929501353+-78.18949646,2023 08:30 HORAS+03+16+08:30,0,0,COE-MTC,CLIMATOLOGICO,PE-08B,CARRETERA CAJAMARCA - CHACHAPOYAS - MOYOBAMBA,SI,interrumpido
318,SI,VIGENTE,BLOQUEO TOTAL,11/03/2023,16/03/2023 08:30 HORAS,LA LIBERTAD/TRUJILLO/HUANCHACO,KM 582,LOCALIDAD EL MILAGRO VIA AFECTADA POR LA ACTIVACION DE QUEBRADA PRODUCTO DE LAS FUERTES LLUVIAS EN LA ZONA. SE ESTAN REALIZANDO LOS TRABAJOS DE RECUPERACION DE LA VIA,-8.043271945,-79.08474981,-8.043271945+-79.08474981,2023 08:30 HORAS+03+16+08:30,0,0,COE-MTC,CLIMATOLOGICO,PE-1N,CARRETERA LONGITUDINAL DE LA COSTA NORTE,SI,interrumpido
26,SI,VIGENTE,BLOQUEO TOTAL,27/02/2023,16/03/2023 08:30 HORAS,ANCASH/PALLASCA/TAUCA,KM 118+200 - KM 118+300,"(SECTOR HIERBABUENA) VIA AFECTADA POR LA PERDIDA DE PLATAFORMA POR DESLIZAMIENTO DE MATERIAL, PRODUCTO DE LA INESTABILIDAD DEL TALUD SUPERIOR Y LLUVIAS EN LA ZONA",-8.499694006,-78.01861306,-8.499694006+-78.01861306,2023 08:30 HORAS+03+16+08:30,0,0,COE-MTC,CLIMATOLOGICO,PE-3NA,CARRETERA LA PAMPA - TAUCA,SI,interrumpido
18,SI,VIGENTE,BLOQUEO TOTAL,12/03/2023,16/03/2023 08:30 HORAS,ANCASH/CORONGO/CUSCA,KM 51,VIA AFECTADA POR ACTIVACION DE QUEBRADAS Y DESBORDE DE ACEQUIAS,-8.57669418,-77.75139682,-8.57669418+-77.75139682,2023 08:30 HORAS+03+16+08:30,0,0,DESPRCAR SIHUAS,CLIMATOLOGICO,PE-12A,CARRETERA LA PAMPA - CUSCA - SIHUAS - HUACRACHUCO - UCHIZA,SI,interrumpido
548,SI,VIGENTE,BLOQUEO TOTAL,10/03/2023,16/03/2023 08:30 HORAS,UCAYALI/PADRE ABAD/NESHUYA,KM 04,VIA AFECTADA POR EL DESBORDE DEL RIO TAHUAYO. PASE VEHICULAR INTERRUMPIDO.,-8.618693122,-74.98405638,-8.618693122+-74.98405638,2023 08:30 HORAS+03+16+08:30,0,0,CEOPOL,CLIMATOLOGICO,UC-102,CARRETERA NESHUYA- CURIMANA,SI,interrumpido
39,SI,VIGENTE,BLOQUEO TOTAL,12/03/2023,16/03/2023 08:30 HORAS,ANCASH/SANTA/MACATE,KM 752+182 - KM 826+753,VIA AFECTADA POR DERRUMBE DEBIDO A LAS CONSTANTES LLUVIAS EN LA ZONA,-8.659285739,-78.23227572,-8.659285739+-78.23227572,2023 08:30 HORAS+03+16+08:30,0,0,COE-MTC,CLIMATOLOGICO,PE-3N,CARRETERA LONGITUDINAL DE LA SIERRA NORTE,SI,interrumpido
17,SI,VIGENTE,BLOQUEO TOTAL,11/03/2023,16/03/2023 08:30 HORAS,ANCASH/CORONGO/BAMBAS,KM 730+280 - KM 742+350,SECTOR HUAROCHIRI VIA AFECTADA POR DERRUMBE DEBIDO A LAS CONSTANTES LLUVIAS EN LA ZONA,-8.662148142,-78.09141316,-8.662148142+-78.09141316,2023 08:30 HORAS+03+16+08:30,0,0,COE-MTC,CLIMATOLOGICO,PE-3N,CARRETERA LONGITUDINAL DE LA SIERRA NORTE,SI,interrumpido
36,SI,VIGENTE,BLOQUEO TOTAL,14/03/2023,16/03/2023 08:30 HORAS,ANCASH/SANTA/CHIMBOTE,KM 43,VIA AFECTADA POR DESLIZAMIENTO,-8.722450855,-78.41856341,-8.722450855+-78.41856341,2023 08:30 HORAS+03+16+08:30,0,0,CEOPOL,CLIMATOLOGICO,PE-12,CARRETERA SANTA - CHUQUICARA,SI,interrumpido
38,SI,VIGENTE,BLOQUEO TOTAL,11/03/2023,16/03/2023 08:30 HORAS,ANCASH/SANTA/CHIMBOTE,KM 40 AL KM 109,VIA AFECTADA POR HUAICO,-8.736049095,-78.44066514,-8.736049095+-78.44066514,2023 08:30 HORAS+03+16+08:30,0,0,CEOPOL,CLIMATOLOGICO,PE-12,CARRETERA SANTA - CHUQUICARA,SI,interrumpido
19,SI,VIGENTE,BLOQUEO TOTAL,11/03/2023,16/03/2023 08:30 HORAS,ANCASH/CORONGO/LA PAMPA,KM 673+350 - KM 710+500,VIA AFECTADA POR DERRUMBE DEBIDO A LAS CONSTANTES LLUVIAS EN LA ZONA,-8.880026369,-77.82886868,-8.880026369+-77.82886868,2023 08:30 HORAS+03+16+08:30,0,0,COE-MTC,CLIMATOLOGICO,PE-3N,CARRETERA LONGITUDINAL DE LA SIERRA NORTE,SI,interrumpido
270,SI,VIGENTE,BLOQUEO TOTAL,10/03/2023,16/03/2023 08:30 HORAS,HUANUCO/HUMALIES/JIRCAN,KM 298+220,SECTOR HUANCASH DESLIZAMIENTO DE TALUD SUPERIOR DEBIDO A LAS LLUVIAS CONSTANTES EN LA ZONA. SE VIENE REALIZANDO LA GESTION NECESARIA PARA LA LIMPIEZA DE DICHO DERRUMBE. SE TIENE TRÁNSITO VEHICULAR INTERRUMPIDO,-9.2305,-76.71892,-9.2305+-76.71892,2023 08:30 HORAS+03+16+08:30,0,0,COE-MTC,CLIMATOLOGICO,PE-14A,CARRETERA HUARAZ - HUANTAR - ANRA - HUACAYBAMBA - TINGO MARIA,SI,interrumpido
267,SI,VIGENTE,BLOQUEO TOTAL,02/03/2023,16/03/2023 08:30 HORAS,HUANUCO/DOS DE MAYO/SHUNQUI,KM 362+100 - KM 362+190,(CENTRO POBLADO CHALCAN - LOCAL KM 125+250) VIA AFECTADA POR DERRUMBE PRODUCTO DE LAS CONSTANTES LLUVIAS EN LA ZONA. SE ESTAN REALIZANDO LOS TRABAJOS DE LIMPIEZA DE LA VIA,-9.779773847,-76.80548867,-9.779773847+-76.80548867,2023 08:30 HORAS+03+16+08:30,0,0,COMISARIA PNP HUANUCO,CLIMATOLOGICO,PE-3N,CARRETERA LONGITUDINAL DE LA SIERRA NORTE,SI,interrumpido
